{
  "$schema": "idlewuxia.fb01_action_state_assertion_policy.v1",
  "contractVersion": 1,
  "taskId": "T03-01",
  "flowSchema": "idlewuxia.first_session_flow.v1",
  "expectedActionCount": 358,
  "fixturePolicy": {
    "unreachableEntityMode": "synthetic_entity_attachment",
    "initialState": "STATE_FS_008_MAP_EXPLORE",
    "initialFlags": ["new_install_or_new_save", "chapter_fb01_entered", "map_node_selected"]
  },
  "assertionRules": {
    "availability": "dispatch_result_must_match_configured_availability",
    "rejected": "semantic_state_delta_must_be_zero",
    "accepted": "accepted_true_requires_executed_or_deferred_status_and_declared_outcome",
    "rejectedFeedback": "feedback_only_condition_failure_requires_rejected_status_and_zero_semantic_mutation",
    "narrativeOnly": "feedback_or_narrative_is_a_valid_zero_mutation_outcome_only_when_execution_status_is_executed",
    "combat": "pending_combat_transition_is_a_valid_declared_outcome",
    "choice": "pending_choice_transition_is_a_valid_declared_outcome"
  },
  "ignoredSnapshotFields": ["events"]
}
